{
  "$schema": "./schema/source.schema.json",
  "schemaVersion": "1.0.0",
  "lastReviewedAt": "2026-07-15",
  "policy": "Technical claims in blockchain content must reference source IDs from this catalog. Protocol claims prefer current first-party documentation, specifications, repositories, or papers. Historical documents are never used to imply current behavior.",
  "sources": [
    {
      "id": "pi-developers",
      "title": "Pi Developer Platform",
      "organization": "Pi Network",
      "url": "https://minepi.com/developers/",
      "sourceType": "official-documentation",
      "official": true,
      "accessedAt": "2026-07-15",
      "lastReviewedAt": "2026-07-15",
      "relevantTopics": ["pi-network", "applications", "pi-browser"],
      "notes": "Current public overview of the Pi developer platform."
    },
    {
      "id": "pi-sdk-core",
      "title": "Pi SDK Core",
      "organization": "Pi Network",
      "url": "https://pi-apps.github.io/pi-sdk-docs/pi-sdk/Core",
      "sourceType": "official-documentation",
      "official": true,
      "accessedAt": "2026-07-15",
      "lastReviewedAt": "2026-07-15",
      "relevantTopics": ["pi-network", "authentication", "payments", "pi-browser"],
      "notes": "Current SDK surface; supports authentication and payment flows."
    },
    {
      "id": "pi-platform-api",
      "title": "Pi Platform API",
      "organization": "Pi Network",
      "url": "https://pi-apps.github.io/pi-sdk-docs/platform/PlatformAPI",
      "sourceType": "official-documentation",
      "official": true,
      "accessedAt": "2026-07-15",
      "lastReviewedAt": "2026-07-15",
      "relevantTopics": ["pi-network", "server-api", "payments", "security"],
      "notes": "Current server-side API guidance; secrets and server verification remain outside clients."
    },
    {
      "id": "pi-mainnet-testnet",
      "title": "Mainnet vs Testnet",
      "organization": "Pi Network",
      "url": "https://pi-apps.github.io/pi-sdk-docs/pitopics/MainVsTest",
      "sourceType": "official-documentation",
      "official": true,
      "accessedAt": "2026-07-15",
      "lastReviewedAt": "2026-07-15",
      "relevantTopics": ["pi-network", "testnet", "mainnet"],
      "notes": "Useful for environment distinctions; enclosed/open-network wording is historical and must be cross-checked against newer announcements."
    },
    {
      "id": "pi-whitepaper-original",
      "title": "Pi Network Whitepaper",
      "organization": "Pi Network",
      "url": "https://minepi.com/white-paper/",
      "sourceType": "historical-whitepaper",
      "official": true,
      "accessedAt": "2026-07-15",
      "lastReviewedAt": "2026-07-15",
      "relevantTopics": ["pi-network", "stellar-consensus-protocol", "social-trust"],
      "notes": "Original 2019 paper plus later chapters. The page warns that original material is not fully current; use only with historical-official status."
    },
    {
      "id": "pi-open-network-launch",
      "title": "Pi Open Network Has Launched",
      "organization": "Pi Network",
      "url": "https://minepi.com/blog/open-network/",
      "sourceType": "official-announcement",
      "official": true,
      "accessedAt": "2026-07-15",
      "lastReviewedAt": "2026-07-15",
      "relevantTopics": ["pi-network", "open-network", "mainnet"],
      "notes": "Current network-phase evidence: Open Network launched in February 2025."
    },
    {
      "id": "pi-trademark-guidelines",
      "title": "Pi Trademark Guidelines",
      "organization": "Pi Network",
      "url": "https://minepi.com/pi-trademark-guidelines/",
      "sourceType": "official-policy",
      "official": true,
      "accessedAt": "2026-07-15",
      "lastReviewedAt": "2026-07-15",
      "relevantTopics": ["pi-network", "trademark", "identity"],
      "notes": "Controls use of Pi marks, name, logo, colors, and implied affiliation."
    },
    {
      "id": "bitcoin-whitepaper",
      "title": "Bitcoin: A Peer-to-Peer Electronic Cash System",
      "organization": "Bitcoin.org",
      "url": "https://bitcoin.org/bitcoin.pdf",
      "sourceType": "protocol-whitepaper",
      "official": true,
      "accessedAt": "2026-07-15",
      "lastReviewedAt": "2026-07-15",
      "relevantTopics": ["bitcoin", "proof-of-work", "transactions", "blocks"],
      "notes": "Foundational protocol paper; pair with current developer references for implementation details."
    },
    {
      "id": "bitcoin-dev-transactions",
      "title": "Bitcoin Developer Guide: Transactions",
      "organization": "Bitcoin.org",
      "url": "https://developer.bitcoin.org/devguide/transactions.html",
      "sourceType": "official-documentation",
      "official": true,
      "accessedAt": "2026-07-15",
      "lastReviewedAt": "2026-07-15",
      "relevantTopics": ["bitcoin", "utxo", "signatures", "transactions"],
      "notes": "Developer-level description of transaction inputs, outputs, and spend conditions."
    },
    {
      "id": "bitcoin-bips",
      "title": "Bitcoin Improvement Proposals",
      "organization": "Bitcoin Core",
      "url": "https://github.com/bitcoin/bips",
      "sourceType": "official-specification-repository",
      "official": true,
      "accessedAt": "2026-07-15",
      "lastReviewedAt": "2026-07-15",
      "relevantTopics": ["bitcoin", "standards", "protocol"],
      "notes": "Canonical BIP repository; individual claims should point to a relevant BIP when detail is added."
    },
    {
      "id": "ethereum-accounts",
      "title": "Ethereum Accounts",
      "organization": "Ethereum Foundation",
      "url": "https://ethereum.org/developers/docs/accounts/",
      "sourceType": "official-documentation",
      "official": true,
      "accessedAt": "2026-07-15",
      "lastReviewedAt": "2026-07-15",
      "relevantTopics": ["ethereum", "account-model", "keys"],
      "notes": "Current account model overview."
    },
    {
      "id": "ethereum-transactions",
      "title": "Ethereum Transactions",
      "organization": "Ethereum Foundation",
      "url": "https://ethereum.org/developers/docs/transactions/",
      "sourceType": "official-documentation",
      "official": true,
      "accessedAt": "2026-07-15",
      "lastReviewedAt": "2026-07-15",
      "relevantTopics": ["ethereum", "transactions", "gas", "signatures"],
      "notes": "Current transaction fields and lifecycle overview."
    },
    {
      "id": "ethereum-smart-contracts",
      "title": "Introduction to Smart Contracts",
      "organization": "Ethereum Foundation",
      "url": "https://ethereum.org/developers/docs/smart-contracts/",
      "sourceType": "official-documentation",
      "official": true,
      "accessedAt": "2026-07-15",
      "lastReviewedAt": "2026-07-15",
      "relevantTopics": ["ethereum", "smart-contracts", "execution"],
      "notes": "Contract code, state, and composability overview."
    },
    {
      "id": "ethereum-pos",
      "title": "Proof-of-Stake Consensus",
      "organization": "Ethereum Foundation",
      "url": "https://ethereum.org/developers/docs/consensus-mechanisms/pos/",
      "sourceType": "official-documentation",
      "official": true,
      "accessedAt": "2026-07-15",
      "lastReviewedAt": "2026-07-15",
      "relevantTopics": ["ethereum", "proof-of-stake", "finality"],
      "notes": "Current Ethereum proof-of-stake overview."
    },
    {
      "id": "ethereum-eip-1559",
      "title": "EIP-1559: Fee Market Change",
      "organization": "Ethereum Improvement Proposals",
      "url": "https://eips.ethereum.org/EIPS/eip-1559",
      "sourceType": "official-specification",
      "official": true,
      "accessedAt": "2026-07-15",
      "lastReviewedAt": "2026-07-15",
      "relevantTopics": ["ethereum", "fees", "congestion", "gas"],
      "notes": "Specification for base fee and priority fee mechanics."
    },
    {
      "id": "ethereum-optimistic-rollups",
      "title": "Optimistic Rollups",
      "organization": "Ethereum Foundation",
      "url": "https://ethereum.org/developers/docs/scaling/optimistic-rollups/",
      "sourceType": "official-documentation",
      "official": true,
      "accessedAt": "2026-07-15",
      "lastReviewedAt": "2026-07-15",
      "relevantTopics": ["ethereum", "optimistic-rollups", "fraud-proofs", "shared-security"],
      "notes": "Current architecture, data availability, challenges, and settlement overview."
    },
    {
      "id": "ethereum-zk-rollups",
      "title": "Zero-Knowledge Rollups",
      "organization": "Ethereum Foundation",
      "url": "https://ethereum.org/developers/docs/scaling/zk-rollups/",
      "sourceType": "official-documentation",
      "official": true,
      "accessedAt": "2026-07-15",
      "lastReviewedAt": "2026-07-15",
      "relevantTopics": ["ethereum", "zk-rollups", "validity-proofs", "shared-security"],
      "notes": "Current ZK-rollup architecture and proof-verification overview."
    },
    {
      "id": "solana-whitepaper",
      "title": "Solana: A New Architecture for a High Performance Blockchain",
      "organization": "Solana Foundation",
      "url": "https://solana.com/solana-whitepaper.pdf",
      "sourceType": "protocol-whitepaper",
      "official": true,
      "accessedAt": "2026-07-15",
      "lastReviewedAt": "2026-07-15",
      "relevantTopics": ["solana", "proof-of-history", "parallel-execution", "consensus"],
      "notes": "Foundational architecture paper; volatile implementation details need current-doc verification."
    },
    {
      "id": "solana-accounts",
      "title": "Solana Account Model",
      "organization": "Solana Foundation",
      "url": "https://solana.com/docs/core/accounts",
      "sourceType": "official-documentation",
      "official": true,
      "accessedAt": "2026-07-15",
      "lastReviewedAt": "2026-07-15",
      "relevantTopics": ["solana", "accounts", "programs", "parallel-execution"],
      "notes": "Current data-account and executable-program concepts."
    },
    {